{"$schema":"https://json-schema.org/draft/2020-12/schema","title":"Battle the Beast to Veiled Dominion lineage","type":"object","required":["source","destination","transferPolicy","mappings","playtestQuestions","excluded","unresolved"],"properties":{"source":{"type":"object","required":["project","classification","rulesAuthority"]},"destination":{"type":"object","required":["project","repository","invariant"]},"transferPolicy":{"type":"string"},"mappings":{"type":"array","items":{"type":"object","required":["sourcePattern","principle","mechanic","status"]}},"playtestQuestions":{"type":"array","items":{"type":"string"}},"excluded":{"type":"array","items":{"type":"string"}},"unresolved":{"type":"array","items":{"type":"string"}}}}
