{"$schema":"./veiled-dominion-lineage.schema.json","source":{"project":"Battle the Beast","classification":"historical/archive design provenance","rulesAuthority":false},"destination":{"project":"Veiled Dominion","repository":"https://github.com/Loptr-Lab/veiled-dominion-engine","invariant":"Power becomes mastery through restraint."},"transferPolicy":"Transfer design principles and testable player experiences, never franchise IP or unreviewed rules.","mappings":[{"sourcePattern":"Power is dangerous in isolation","principle":"Power creates positional responsibility","mechanic":"Radius of Ruin","status":"canonical-design"},{"sourcePattern":"No singular chosen one","principle":"Asymmetry requires interdependence","mechanic":"Four-player asymmetric factions","status":"canonical-design"},{"sourcePattern":"A stabilizing catalyst","principle":"Relationship can constrain dangerous power","mechanic":"Death's Sanctuary","status":"canonical-design"},{"sourcePattern":"Loss is transformed, not erased","principle":"Removed pieces retain consequence","mechanic":"Soul Reservoir","status":"canonical-design"},{"sourcePattern":"Chosen sacrifice protects the group","principle":"Voluntary loss creates limited restraint","mechanic":"Martyr's Boon","status":"canonical-design"},{"sourcePattern":"Resets cannot repair overwritten agency","principle":"Restraint is a valid path to mastery","mechanic":"Leadership/Mercy victory","status":"canonical-design"}],"playtestQuestions":["Does moving Rebirth feel powerful and dangerous to allies at the same time?","Can a non-capturing move be strategically meaningful?","Do pieces in the Graveyard continue to affect decisions?","Does Death's position create a readable and useful sanctuary?","Can a winning line demonstrate leadership without domination?"],"excluded":["The Magicians characters","Syfy chronology","Fillory and Neitherlands","seven keys","third-party images, music, videos, and lyrics"],"unresolved":["Whether canonical four-player Rebirth can herself become Veiled"]}
